{
  "$schema": "https://json-schema.org/draft/2020-12/schema",
  "$id": "https://raw.githubusercontent.com/api-evangelist/amazon-cognito/refs/heads/main/json-schema/user-pools-admin-create-user-request-schema.json",
  "title": "AdminCreateUserRequest",
  "description": "Represents the request to create a user in the specified user pool.",
  "type": "object",
  "properties": {
    "UserPoolId": {
      "allOf": [
        {
          "$ref": "#/components/schemas/UserPoolIdType"
        },
        {
          "description": "The user pool ID for the user pool where the user will be created."
        }
      ]
    },
    "Username": {
      "allOf": [
        {
          "$ref": "#/components/schemas/UsernameType"
        },
        {
          "description": "The username for the user. Must be unique within the user pool. Must be a UTF-8 string between 1 and 128 characters. After the user is created, the username can't be changed."
        }
      ]
    },
    "UserAttributes": {
      "allOf": [
        {
          "$ref": "#/components/schemas/AttributeListType"
        },
        {
          "description": "<p>An array of name-value pairs that contain user attributes and attribute values to be set for the user to be created. You can create a user without specifying any attributes other than <code>Username</code>. However, any attributes that you specify as required (when creating a user pool or in the <b>Attributes</b> tab of the console) either you should supply (in your call to <code>AdminCreateUser</code>) or the user should supply (when they sign up in response to your welcome message).</p> <p>For custom attributes, you must prepend the <code>custom:</code> prefix to the attribute name.</p> <p>To send a message inviting the user to sign up, you must specify the user's email address or phone number. You can do this in your call to AdminCreateUser or in the <b>Users</b> tab of the Amazon Cognito console for managing your user pools.</p> <p>In your call to <code>AdminCreateUser</code>, you can set the <code>email_verified</code> attribute to <code>True</code>, and you can set the <code>phone_number_verified</code> attribute to <code>True</code>. You can also do this by calling <a href=\"https://docs.aws.amazon.com/cognito-user-identity-pools/latest/APIReference/API_AdminUpdateUserAttributes.html\">AdminUpdateUserAttributes</a>.</p> <ul> <li> <p> <b>email</b>: The email address of the user to whom the message that contains the code and username will be sent. Required if the <code>email_verified</code> attribute is set to <code>True</code>, or if <code>\"EMAIL\"</code> is specified in the <code>DesiredDeliveryMediums</code> parameter.</p> </li> <li> <p> <b>phone_number</b>: The phone number of the user to whom the message that contains the code and username will be sent. Required if the <code>phone_number_verified</code> attribute is set to <code>True</code>, or if <code>\"SMS\"</code> is specified in the <code>DesiredDeliveryMediums</code> parameter.</p> </li> </ul>"
        }
      ]
    },
    "ValidationData": {
      "allOf": [
        {
          "$ref": "#/components/schemas/AttributeListType"
        },
        {
          "description": "<p>The user's validation data. This is an array of name-value pairs that contain user attributes and attribute values that you can use for custom validation, such as restricting the types of user accounts that can be registered. For example, you might choose to allow or disallow user sign-up based on the user's domain.</p> <p>To configure custom validation, you must create a Pre Sign-up Lambda trigger for the user pool as described in the Amazon Cognito Developer Guide. The Lambda trigger receives the validation data and uses it in the validation process.</p> <p>The user's validation data isn't persisted.</p>"
        }
      ]
    },
    "TemporaryPassword": {
      "allOf": [
        {
          "$ref": "#/components/schemas/PasswordType"
        },
        {
          "description": "<p>The user's temporary password. This password must conform to the password policy that you specified when you created the user pool.</p> <p>The temporary password is valid only once. To complete the Admin Create User flow, the user must enter the temporary password in the sign-in page, along with a new password to be used in all future sign-ins.</p> <p>This parameter isn't required. If you don't specify a value, Amazon Cognito generates one for you.</p> <p>The temporary password can only be used until the user account expiration limit that you set for your user pool. To reset the account after that time limit, you must call <code>AdminCreateUser</code> again and specify <code>RESEND</code> for the <code>MessageAction</code> parameter.</p>"
        }
      ]
    },
    "ForceAliasCreation": {
      "allOf": [
        {
          "$ref": "#/components/schemas/ForceAliasCreation"
        },
        {
          "description": "<p>This parameter is used only if the <code>phone_number_verified</code> or <code>email_verified</code> attribute is set to <code>True</code>. Otherwise, it is ignored.</p> <p>If this parameter is set to <code>True</code> and the phone number or email address specified in the UserAttributes parameter already exists as an alias with a different user, the API call will migrate the alias from the previous user to the newly created user. The previous user will no longer be able to log in using that alias.</p> <p>If this parameter is set to <code>False</code>, the API throws an <code>AliasExistsException</code> error if the alias already exists. The default value is <code>False</code>.</p>"
        }
      ]
    },
    "MessageAction": {
      "allOf": [
        {
          "$ref": "#/components/schemas/MessageActionType"
        },
        {
          "description": "Set to <code>RESEND</code> to resend the invitation message to a user that already exists and reset the expiration limit on the user's account. Set to <code>SUPPRESS</code> to suppress sending the message. You can specify only one value."
        }
      ]
    },
    "DesiredDeliveryMediums": {
      "allOf": [
        {
          "$ref": "#/components/schemas/DeliveryMediumListType"
        },
        {
          "description": "Specify <code>\"EMAIL\"</code> if email will be used to send the welcome message. Specify <code>\"SMS\"</code> if the phone number will be used. The default value is <code>\"SMS\"</code>. You can specify more than one value."
        }
      ]
    },
    "ClientMetadata": {
      "allOf": [
        {
          "$ref": "#/components/schemas/ClientMetadataType"
        },
        {
          "description": "<p>A map of custom key-value pairs that you can provide as input for any custom workflows that this action triggers.</p> <p>You create custom workflows by assigning Lambda functions to user pool triggers. When you use the AdminCreateUser API action, Amazon Cognito invokes the function that is assigned to the <i>pre sign-up</i> trigger. When Amazon Cognito invokes this function, it passes a JSON payload, which the function receives as input. This payload contains a <code>clientMetadata</code> attribute, which provides the data that you assigned to the ClientMetadata parameter in your AdminCreateUser request. In your function code in Lambda, you can process the <code>clientMetadata</code> value to enhance your workflow for your specific needs.</p> <p>For more information, see <a href=\"https://docs.aws.amazon.com/cognito/latest/developerguide/cognito-user-identity-pools-working-with-aws-lambda-triggers.html\"> Customizing user pool Workflows with Lambda Triggers</a> in the <i>Amazon Cognito Developer Guide</i>.</p> <note> <p>When you use the ClientMetadata parameter, remember that Amazon Cognito won't do the following:</p> <ul> <li> <p>Store the ClientMetadata value. This data is available only to Lambda triggers that are assigned to a user pool to support custom workflows. If your user pool configuration doesn't include triggers, the ClientMetadata parameter serves no purpose.</p> </li> <li> <p>Validate the ClientMetadata value.</p> </li> <li> <p>Encrypt the ClientMetadata value. Don't use Amazon Cognito to provide sensitive information.</p> </li> </ul> </note>"
        }
      ]
    }
  },
  "required": [
    "UserPoolId",
    "Username"
  ]
}